,name,category,author,categories_list,view_count,ratting_value,ratting_count,chapter_cout
1633, You are my sunshine  ,School Life,Misaka,"School Life, Comic, VnComic, Manga, ","71,982",4,71982,Giới thiệu nhân vật 
1634,Detective Academy Q,School Life,Kibayashi Shin - Satou Fumiya,"Mystery, School Life, Manga, Trinh Thám, ","71,981",4,71981,Chapter 68
1635,Pumpkin Knight - Naoko Trong Viện Tâm Thần,Horror,Đang cập nhật,"Action, Psychological, Horror, Manga, ","71,979",4,71979,Chapter 3
1636,Miêu tương phản chuyển,Manhua,Thần Mạn,"Manhua, Romance, Fantasy, Supernatural, Adventure, Action, Comedy, ","71,975",4,71975,Chap 5 
1637,Bạn trai 2 mặt,School Life,JeberAm,"Romance, School Life, ","71,973",4,71973,Chap 2
1638,Đô Thị Hàng Thần Khúc,Mystery,Đang cập nhật,"Action, Mystery, Xuyên Không, Manhua, Adventure, ","20,069",4,20069,Chapter 113
1639,Magan & Danai,Manhua,,"Manhua, Webtoon, Slice of Life, Romance, Shoujo-ai, Comedy, ","71,963",4,71963,Magan & danai chap 12
1640,Triangle,,Đang cập nhật,", ","71,960",4,71960,Chapter 1: Oneshot
1641,Aoi - Hikaru ga Chikyuu ni Itakoro......,School Life,"NOMURA Mizuki,YAMASAKI Fuua","Drama, Romance, Supernatural, School Life, Shounen, ","62,300",4,62300,"""aoi"" "
1642,"Năm đó, dưới những ánh sao trên trời",Romance,Mộc thiên linh,"Romance, Shoujo, Webtoon, ","71,989",4,71989,Không liên quan đến truyện
1643,Nhật Ký Nuôi Dưỡng Công Chúa,Comedy,Đang cập nhật,"Cổ Đại, Romance, Shoujo, Comedy, Manhua, ","71,950",4,71950,Chapter 14
1644,Mắc Kẹt Trên Mặt Trăng,Drama,Đang cập nhật,"Drama, Comedy, Adventure, Manhwa, Tragedy, ","71,953",4,71953,Chapter 2020
1645,Gravel Kingdom,Action,Kaori Yuki,"Action, Manga, Sci-fi, Adventure, ","71,935",4,71935,Chapter 2: Kanai
1646,Ame Nimo Mayuwanai,Comedy,honjou rie,"Drama, Slice of Life, Comedy, Shoujo Ai, Shounen, ","71,933",4,71933,Chapter 1: One shot
1647,Kimi wa Shoujo,Soft Yuri,Đang cập nhật,"Slice of Life, School Life, Shoujo, Soft Yuri, ","71,930",4,71930,Chapter 6
1648,Ánh Sao Đêm I,Romance,Đang cập nhật,"Romance, Comedy, ","71,929",4,71929,Chapter 2: End
1649,Lính đánh thuê Maruhan,Adventure,Kim Sung - jae,"Action, Shounen, Tragedy, Historical, Adventure, ","71,923",4,71923,Chapter 78
1650,Tuyệt Thế Vô Song 2,Manhua,Hà Chí Văn,"Manhua, Martial Arts, Historical, ","71,930",4,71930,Chapter 128
1651,Tình yêu độc quyền của chủ tịch,Romance,Mạc Mạc,"Drama, Romance, Manhua, ","71,922",4,71922,Chap 3
1652,Tối Cường Đặc Chủng Binh Của Hoa Khôi,Manhua,Đang cập nhật,"Action, School Life, Comedy, Manhua, ","71,924",4,71924,Chapter 114
1653,Tôi không yêu gái 3d,Drama,Tao Noritake,"Drama, Harem, Romance, School Life, Comedy, Manga, ","71,916",4,71916,Chapter 47
1654,"APH doujinshi - I let out word, I felt your touch",Shoujo Ai,WIMPS - Pixiv Id 1420508,"Shoujo Ai, One Shot, Doujinshi, Shounen, ","71,911",4,71911,Chapter 1
1655,Namida no Memory,One Shot,Mayami,"Slice of Life, Shounen-ai, Comedy, One Shot, ","71,911",4,71911,Oneshot
1656,[Truyện Tranh] Warui Koto Shitai - Bản Tiếng Việt Mới Nhất,Shounen-ai,Sakuraga Mei,"Shounen-ai, ","71,910",4,71910,Warui Koto Shitai Chap Extra
1657,Ánh Sáng Tuổi Thơ,Manga,Gấu Pink,"Drama, Manga, ","71,908",4,71908,Chap 2 a~~
1658,Tôi Mở Rạp Hát Ở Cổ Đại,Xuyên không,Sang Chảnh Team,"Cổ Đại, Romance, Xuyên không, Manhua, ","71,907",4,71907,Chap 2
1659,Next Crows Supplementary Story,Action,Takahashi Hiroshi,"Action, School Life, Comedy, Shounen, ","71,902",4,71902,Next crows supplementary story chương 4
1660,Hoa Đạo Sĩ,Manhua,Cao Long Hạo + Kim Văn Kính,"Romance, Manhua, ","71,900",4,71900,Chapter 52
1661,Thế Giới Ngọc Rồng Fukkatsu no F,Manga,Đang cập nhật,"Shounen, Fantasy, Adventure, Action, Martial Arts, Manga, ","71,897",4,71897,Chapter 3: 
1662,Biohazard - Marhawa Desire,Action,Naoki Serizawa,"Action, Adventure, Sci-fi, Manga, ","71,911",4,71911,Chapter 50
1663,13 Club,Horror,Shihira Tatsuya,"Sci-fi, Slice of Life, Horror, Psychological, Adventure, Action, ","71,896",4,71896,13 club chap 11: end
1664,Thần Bẫy được triệu hồi sang dị giới: Kẻ săn anh hùng,Adventure,Wadapen,"Romance, Shounen, Drama, Fantasy, Supernatural, Adventure, Action, Comic, Tragedy, Anime, ","71,891",4,71891,Chapter 8
1665,Cha Vợ Đại Nhân Là Bà Xã,Drama,Nguyệt Quan Nhật Tinh Không Xã - Linh Miêu Nhóm,"Drama, Comic, Manhua, Đam Mỹ, ","71,888",4,71888,Chapter 4
1666,Last Ranker -Be the Last One,Shounen,Ueda Satoshi,"Action, Fantasy, Adventure, Shounen, ","71,886",4,71886,Last ranker 
1667,Hợp đồng làm sẵn,Slice of Life,Đang cập nhật,"Romance, Slice of Life, ","71,874",4,71874,Chapter 1
1668,Thần Tinh Vật Ngữ,Shoujo,,"Romance, Shoujo, Manhua, ","71,869",4,71869,Thần tinh vật ngữ – chap 12
1669,Penny Dreadful,Supernatural,Chris King; Krysty Wilson - Cairns; Andrew Hinderaker,"Mystery, Comic, Supernatural, Horror, ","71,867",4,71867,Chapter 1
1670,Nguyên Thủy Bất Diệt Quyết,Adventure,Đang cập nhật,"Action, Manhua, Adventure, ","71,865",4,71865,Chapter 43
1671,Ogeha,Sci-fi,Oimo,"Drama, Horror, Shoujo, Sci-fi, ","71,863",4,71863,Ogeha phần cuối
1672,fushigi,Anime,Đang cập nhật,"Anime, ","71,863",4,71863,Chapter 1
1673,Furumapura,Slice of Life,Đang cập nhật,"Slice of Life, School Life, Comedy, Manga, Yuri, ","71,862",4,71862,Chapter 3
1674,Class Room,Shounen,Raiku Makoto,"School Life, Horror, One Shot, Supernatural, Shounen, ","71,861",4,71861,Class Room OneShot
1675,Love N Life ,Comic,Đang cập nhật,"Drama, Magic, Webtoon, Manhwa, Romance, Fantasy, Comic, ","71,858",4,71858,Chapter 0 
1676,Quan chuyên hót phân: Miêu vương tại thượng!,Shoujo,Nguyên Khí Đan Động Mạn ,"Slice of Life, Romance, Shoujo, Comedy, ","71,858",4,71858,Chap 5: Còn Muốn Sao
1677,Warugakis Report Manga,Comedy,Warugaki (SK - II),"Slice of Life, Comedy, Doujinshi, ","71,848",4,71848,Chapter 7: 
1678,Thảm Họa Ong Độc,Manhwa,Kim Gyu Sam,"Action, Manhwa, ","71,846",4,71846,Chapter 242
1679,Usagi-Kun No Shitsukekata,Comedy,Natsume Mikan,"School Life, Shoujo, Comedy, ","71,840",4,71840,Chap 1
1680,Bara Kangoku No Kemono-Tachi,Harem,,"Drama, Harem, Romance, Shoujo, Supernatural, Comedy, ","71,831",4,71831,Bara Kangoku No Kemono
1681,Thánh Tôn Thần Giới,Manhua,Đang cập nhật,"Action, Fantasy, Manhua, ","71,881",4,71881,Chapter 10
1682,Truyện vui về game Cross Fire,Mystery,Không rõ,"Mystery, Tạp chí truyện tranh, Action, Adventure, Shounen, ","71,829",4,71829,Truyện vui về game cross fire chap 7
1683,Chủ Nhiệm Lớp Là Kim Bài Quản Lý,Romance,Đang cập nhật,"Romance, School Life, Shoujo, Manhua, ","71,817",4,71817,Chapter 9
1684,Mainichi Ni Kimi No Koto Bakari,School Life,Đang cập nhật,"Romance, School Life, Shoujo, Comedy, One Shot, ","71,802",4,71802,Chapter 1: One shot
1685,SP x Baby,Comedy,Enjouji Maki.,"Drama, Seinen, Comedy, ","71,801",4,71801,Sp x baby – chap 10
1686,Mẹ! Con không thích vị hôn thê này,Comedy,Moon,"Romance, Comedy, ","71,798",4,71798,Tin buồn
1687,Vòng Bạn Bè Mạnh Nhất Của Tiên Giới,Action,Đang cập nhật,"Action, Mystery, Manhua, ","71,799",4,71799,Chapter 80
1688,Công Tước Mặt Lạnh Của Tiểu Thư Bất Hạnh phần 2,Manhua,Hóng Hớt Truyện Tranh,"Drama, Harem, Manhua, ","71,866",4,71866,Chap 21+22+23+24+25
1689,Em Bé Và Tôi,Comedy,AGAWA Marimo,"Drama, Slice of Life, Shoujo, Comedy, ","85,484",4,85484,Em bé và tôi chap 108: câu chuyện thứ 103: trưởng thành (phần 2)
1690,Hikitateyaku no Koi,Drama,Shimaki Ako,"Drama, Romance, Shoujo, School Life, ","71,789",4,71789,Hikitateyaku no koi hikitateyaku no koi chap 2
1691,Độc Nhất Sủng Ái: Bảo Bối Ngọt Ngào Của Tôi,Drama,Nhạc Du Ánh Họa,"Drama, Romance, Manhua, ","71,809",4,71809,Chap 9
1692,Tsuiraku Jk To Haijin Kyoushi,Drama,Đang cập nhật,"Drama, Romance, Shoujo, Comedy, School Life, ","71,781",4,71781,Chapter 26.1
1693,Colorful shounen to monochrome na atashi,Shoujo,Đang cập nhật,"Romance, School Life, Shoujo, One Shot, ","71,779",4,71779,Chapter 1: One shot
1694,Chun Hyang Bi Hwa,School Life,Đang cập nhật,"Fantasy, Romance, School Life, Shoujo, Adventure, Historical, ","71,775",4,71775,Chapter 2
1695,Người Ba Độc Thân,Slice of Life,Đang cập nhật,"Slice of Life, Manhua, ","71,774",4,71774,Chapter 25
1696,Thiên thần đến từ địa ngục,Action,DTkorea,"Action, Fantasy, ","71,773",4,71773,Chap 1
1697,Fuyu no Hana ♦ Đông trùng hạ thảo,Drama,Sumomo Yumeka,"Drama, One Shot, ","71,772",4,71772,Chapter 1
1698,Mùa Của Su,Romance,,"Drama, Romance, Manhua, ","71,771",4,71771,Chapter 5
1699,Đích Nữ Chư Hầu,Cổ Đại,Oh myka,"Cổ Đại, Manhua, Manga, ","71,768",4,71768,Chap 8
1700,Thiếu nữ của các loài hoa,Anime,Túy Phiêu ,"Anime, Art Book, ","71,776",4,71776,Chapter 8: hoa sen
1701,Mononoke,Supernatural,Ninagawa Yaeko,"Mystery, Seinen, Horror, Supernatural, Historical, Tragedy, ","71,765",4,71765,Mononoke chap 19
1702,"Tenseishichatta yo (Iya, Gomen)",Comic,Đang cập nhật,"Fantasy, Comic, Harem, ","71,763",4,71763,Chapter 25.4
1703,Âm Dương Miện,Adventure,Đường Gia Tam Thiếu,"Action, Manhua, Adventure, ","71,780",4,71780,Chapter 31
1704,Vua Thức Tỉnh,Xuyên không,KuDo,"Mystery, Magic, Xuyên không, Martial Arts, ","71,759",4,71759,Chap 6
1705,Buchimaru Chaos,Seinen,Đang cập nhật,"Action, Fantasy, Seinen, Historical, ","71,757",4,71757,Chapter 5
1706,NGÀNH GIẢI TRÍ THƯỢNG VỊ CHỈ NAM,Đam Mỹ,Sa Bà Phiêu Bạt,"Manhua, Đam Mỹ, ","71,749",4,71749,Chap 10
1707,Watashi ni XX Shinasai!,Romance,TOOYAMA Ema,"Drama, Romance, Shoujo, Comedy, School Life, ","71,773",4,71773,Watashi ni xx shinasai! – chap 74.5
1708,Truy tìm Người ấy,Romance,Hanas,"Romance, School Life, Shoujo, Slice of Life, ","71,746",4,71746,Chap 22
1709,Bishoujo Senshi Sailor Moon,School Life,Takeuchi Naoko,"Sci-fi, Romance, School Life, Adventure, Action, Manga, ","71,736",4,71736,Chapter 2: 
1710,Dragon Collection,Action,"KANESHIRO Muneyuki,SHIBANO Kyouta","Action, Fantasy, Comedy, Adventure, Shounen, ","71,735",4,71735,Dragon collection chap 10
1711,Kure-nai,Martial Arts,Yamamoto Yamoto - Katayama Kentarou,"Action, School Life, Martial Arts, Manga, ","71,721",4,71721,Chapter 27
1712,After Effects Radio,Supernatural,Đang cập nhật,"Seinen, Supernatural, ","71,719",4,71719,Chapter 18
1713,Dù là lời nói dối cũng không sao,One Shot,Đang cập nhật,"One Shot, Shoujo-ai, ","71,719",4,71719,Chapter 1: One shot
1714,Đồng Hồ Thần Cấp Siêu Năng Của Ta,Manhua,Đang cập nhật,"Action, Fantasy, Manhua, ","71,713",4,71713,Chapter 31
1715,Kyoukai no Nai Sekai,Seinen,,"Seinen, Romance, School Life, Shoujo, Comedy, Manga, ","71,709",4,71709,Kyoukai no nai sekai chap 4
1716,Sức Thanh Xuân,Fantasy,Hwang Mi Ri,"Romance, Fantasy, Shoujo, Comedy, Manhwa, ","71,706",4,71706,Chapter 13
1717,Cực Phẩm MaMa Không Dễ Chọc,Comic,Lạc Tâm Thần,"Drama, Comic, ","71,702",4,71702,Chap 2
1718,Trường Phong Quyển,Manhua,Huyển Âm Các,"Cổ Đại, Manhua, Đam Mỹ, ","71,702",4,71702,Chap 5
1719,Onimiya-sensei no Kiss ni wa Sakaraenai,Romance,kayoru,"Romance, School Life, Shoujo, ","71,700",4,71700,Onimiya
1720,Thợ Săn Ma,Drama,Fuyumi Ono,"Drama, Mystery, Horror, Supernatural, Shoujo, ","71,695",4,71695,chap 7
1721,Nhật Ký Tu Luyện Của Võ Đế,Manhua,Đang cập nhật,"Martial Arts, Manhua, ","71,689",4,71689,Chapter 1
1722,Lueduo Diren De Xin,Yaoi,Yusa,"Romance, Yaoi, ","71,689",4,71689,Cưỡng đoạt địch nhân tâm chap 8
1723,Dei Ecchi Ei,Shounen,"YUUKI Rin,Tanimura Marika","Romance, Harem, Supernatural, Shounen, ","71,683",4,71683,Chap 14
1724,[Truyện Tranh] Cross Days - Full Tiếng Việt Mới Nhất,Romance,Sakazuki Homare,"Harem, Shounen, Romance, School Life, Gender Bender, Comedy, ","71,686",4,71686,Cross days chap 13 (end)
1725,Peach Love,School Life,Đang cập nhật,"Romance, School Life, Slice of Life, Manhwa, Đam Mỹ, ","71,673",4,71673,Chapter 15
1726,Cậu Mới Là Người Dễ Thương Nhất,Comedy,Đang cập nhật,"Romance, Comedy, Manga, ","71,703",4,71703,Chapter 3
1727,Boy + Girl Fusion,Action,,"Action, Gender Bender, One Shot, ","71,663",4,71663,Boy + Girl Fusion OneShot
1728,Shunkan Gradation,Romance,Đang cập nhật,"Romance, School Life, ","71,661",4,71661,Chapter 7
1729,Zoushoku Shoujo Plana-chan!,School Life,HARUSE Hiroki,"School Life, Comedy, Shounen, ","40,704",4,40704,Zoushoku shoujo plana
1730,Mỹ Nhân Sách,Cổ Đại,Tả Ngạn Tạp Mạn Đồ,"Cổ Đại, Romance, ","71,657",4,71657,Chap 7
1731,Shokubutsu Zukan,Tragedy,Tsutsumi Kakeru,"Romance, Shoujo, Tragedy, ","71,656",4,71656,Chapter 3
1732,Cell,Action,Đang cập nhật,"Action, Fantasy, Manhwa, School Life, ","71,707",4,71707,Chapter 11
1733,Yugami-kun ni wa Tomodachi ga Inai Manga,Shounen,Sakura Jun,"Romance, School Life, Comedy, Slice of Life, Shounen, ","71,653",4,71653,Yugami
1734,Hitori Yogari,Yuri,Bách Quỷ Team,"School Life, One Shot, Yuri, Shoujo-ai, ","71,647",4,71647,Chap 1: Oneshot
1735,Câu Chuyện Tuyệt Vời của Sao,Comedy,Đang cập nhật,"Romance, Shoujo, Comedy, Manhua, ","71,646",4,71646,Chapter 16
1736,Anadorenai Ne Kitami-kun,Shoujo,SANADA Chika,"Romance, School Life, Shoujo, Comedy, ","71,642",4,71642,Chapter 5
1737,Hoa Dữ Ẩn Nặc Chi Ô,Romance,Đang cập nhật,"Tạp chí truyện tranh, Manhua, Romance, Comic, Comedy, Drama, ","71,993",4,71993,Chapter 94
1738,Minh tinh lão ca thỉnh xuất chiêu!(Drop),Comedy,mika小柴犬,"Romance, Comedy, Manhua, ","71,637",4,71637,chap 10
1739,Undead (TERASHIMA Masashi),Shounen,TERASHIMA Masashi,"Action, Horror, Supernatural, Tragedy, Shounen, ","71,635",4,71635,Undead (terashima masashi) chap 2: the power squirming within me
1740,Hệ Thống Tu Tiên Mạnh Nhất,Mystery,Đang cập nhật,"Mystery, Manhua, ","71,650",4,71650,Chapter 141
1741,Yêu cầu khẩn cấp: Cách nuôi một con rồng bị bỏ rơi !,Fantasy,Kitoracon - Assamutee Topia,"Romance, Fantasy, Slice of Life, Manga, Shounen, ","71,622",4,71622,Chapter 9
1742,Omae Wa Hitsuji,School Life,Takasaki Bosco,"Romance, School Life, Yaoi, ","71,625",4,71625,Omae wa hitsuji 
1743,Bokura no Hentai,Manga,Fumiko Fumi,"Manga, ","71,622",4,71622,Chapter 5
1744,Kuroko no Basket,Sports,Fujimaki Tadatoshi,"School Life, Manga, Sports, ","71,663",4,71663,Chapter 275.5: 
1745,Chim Hoàng Yến Bị Trói Buộc Bởi Chính Mình,Manhua,绿野千鹤/晋江文学城+博易漫画 晋江文学城 绿野千鹤 博易漫画,"Manhua, Đam Mỹ, ","71,615",4,71615,Chapter 3
1746,Online - The Comic,Shounen,"Kyoka Tsukasa,Keropyon","Drama, Psychological, Horror, Shounen, ","71,613",4,71613,Online 
1747,Unbalance X Unbalance,,Đang cập nhật,", ","71,600",4,71600,Chapter 82: (END)
1748,A-bout!,Comedy,Ichikawa Masa,"Action, School Life, Comedy, Shounen, ","26,332",4,26332,A
1749,Fate/Zero - Couple Table,Comedy,Akinuko,"Comedy, Doujinshi, ","71,589",4,71589,Fate/zero 
1750,Task Force for Paranormal Disaster Management,Seinen,Inoue Junya - Shirato Seichi,"Action, Drama, Seinen, Supernatural, Manga, ","71,575",4,71575,Chapter 2
1751,Higanjima SS3,Horror,Đang cập nhật,"Fantasy, Horror, Seinen, Manga, ","71,614",4,71614,Chapter 217
1752,Tatoeba Last Dungeon Mae No Mura No Shounen Ga Joban No Machi De Kurasu Youna Monogatari,Fantasy,Satou Toshio,"Action, Fantasy, Adventure, Manga, ","71,575",4,71575,Chapter 9.5
1753,Julian and Youth A,Shoujo Ai,Xi Xi Guo,"Manhua, One Shot, Romance, Shoujo, Comedy, Shoujo Ai, ","71,572",4,71572,Chapter 1: One shot
1754,Ojou to Nanahiki no Inu,Comedy,Iwatobi Neko,"Seinen, Drama, Fantasy, Supernatural, Action, Comedy, ","71,572",4,71572,Chapter 2
1755,Dead End Loop,Manga,Đang cập nhật,"Mystery, Seinen, Horror, Manga, ","71,561",4,71561,Chapter 2
1756,Kinkyori Renai,School Life,Mikimoto Rin,"Romance, School Life, Shoujo, Comedy, ","71,557",4,71557,Kinkyori ren'ai chap 9
1757,Công lược trưởng thành của Vương Phi,Manhua,Liệp Tinh Thì Đại Luyến Ái,"Cổ Đại, Romance, Xuyên không, Manhua, ","58,304",4,58304,Tuyển thành viên
1758,Nghịch Chuyển Tiên Đồ,Manhua,Đang cập nhật,"Mystery, Manhua, ","71,557",4,71557,Chapter 182
1759,Yomitai Hon wa Nai Keredo,Romance,Đang cập nhật,"Romance, Slice of Life, Comedy, Shounen, ","71,541",4,71541,Chapter 1
1760,"Kumo no Mukou, Yakusoku no Basho - Lời hứa ngày ấy",Drama,"Sahara Mizu,Shinkai Makoto","Drama, Psychological, Romance, Sci-fi, Seinen, ","71,535",4,71535,"Kumo no mukou, yakusoku no basho "
1761,Tiểu thư giả mạo,Manhua,Mã Ác,"Romance, Comedy, Manhua, ","71,530",4,71530,Chap 51
1762,Ankoku Kishi Danchou to Seishun Garu,Comedy,Đang cập nhật,"Fantasy, Seinen, Comedy, ","71,524",4,71524,Chapter 2
1763,Thần Quân Đại Nhân Tại Thượng Tiểu Hồ Ly Khoái Tẩu,Xuyên không,Con Gái nô Team,"Xuyên không, Manhua, Webtoon, ","71,525",4,71525,THÔNG BÁO KHẨN
1764,Marmalade Boy,School Life,Yoshizumi Wataru,"Romance, Slice of Life, Sports, Psychological, School Life, Shoujo, Comedy, Drama, ","71,529",4,71529,Marmalade boy chap cuối
1765,Rin!,,Đang cập nhật,", ","71,519",4,71519,Chapter 11
1766,Tổng Tài Phu Nhân Không Muốn Giải Cứu Thế Giới,Shoujo,Đang cập nhật,"Romance, Shoujo, Manhua, ","71,515",4,71515,Chapter 1
1767,Nụ hôn phép thuật,Romance,Omote Sora,"Romance, Gender Bender, Shoujo, Comedy, Supernatural, ","71,514",4,71514,Chapter 5
1768,Sukuri zo!,Seinen,Đang cập nhật,"Slice of Life, School Life, Seinen, Comedy, Manga, ","71,513",4,71513,Chapter 3
1769,Chiến binh Siêu Âm Thanh,Adventure,Sandra Diaz,"Action, Adventure, ","71,509",4,71509,Chapter 1
1770,Hôn quân thăng cấp ký,Comedy,Đang cập nhật,"Drama, Romance, Comedy, Manhua, ","71,506",4,71506,Chapter 46
1771,KORE IJOU ISHIKI SHINAI NANTE MURI DAYO!,Shoujo,Macchaume,"Shoujo, ","71,500",4,71500,Chapter 1: One shot
1772,Trở Về Đại Đường Làm Nữ Thần,Xuyên Không,,"Mystery, Romance, Shoujo, Xuyên Không, Manhua, ","71,489",4,71489,Trở về đại đường làm nữ thần – chap 7
1773,Ma Vương Sau Bộ Vest: Tổng Tài Khó Chiều Cưa Không Nổi,Comedy,Đang cập nhật,"Romance, Shoujo, Comedy, Manhua, ","71,487",4,71487,Chapter 56
1774,Toshiue elite onna kishi ga boku no mae de dake kawaii,Romance,Yosuke Yoshino - Takata,"Romance, Seinen, Comedy, Manga, ","71,483",4,71483,Chapter 4
1775,Yugamira,Gender Bender,Đang cập nhật,"Romance, Comedy, Gender Bender, ","71,477",4,71477,Chapter 1: One shot
1776,Binetsu Kuukan,Shoujo,Aoki Ume,"Josei, Slice of Life, Romance, School Life, Shoujo, Action, Comedy, Manga, ","71,470",4,71470,Binetsu Kuukan chapter 12
1777,Sao Lại Là Yêu?,Manhua,Đang cập nhật,"Cổ Đại, Romance, Manhua, ","71,480",4,71480,Chapter 7
1778,Hakudatsu No Masquerade,Adventure,Tsubaki Kawori,"Drama, Fantasy, Shoujo, Adventure, Mystery, ","71,460",4,71460,Chap 4
1779,Genjuu Chousain,Manhua,Đang cập nhật,"Action, Xuyên Không, Manhua, Adventure, Shounen, ","71,458",4,71458,Chapter 4
1780,Otome Holic,Shoujo,Komori Mikko,"Romance, School Life, Shoujo, ","71,454",4,71454,Otome holic – chap 7
1781,Đông Anh Diệu Dương,Action,Ngưu Lão,"Action, Manhua, Martial Arts, ","71,452",4,71452,Chapter 3: tay đôi tứ nhị lục
1782,Truyện ngày xưa (ngoại truyện),Drama,Mer Quyên,"Cổ Đại, Drama, ","71,453",4,71453,Thông báo cho bạn đọc
1783,Houkago no Goumon Shoujo,Slice of Life,Boku,"Slice of Life, School Life, Harem, Comedy, ","71,451",4,71451,Chapter 2.5
1784,INHUMANITY,Comic,Marvel Comics,"Action, Comic, Sci-fi, Adventure, ","71,450",4,71450,Chapter 1
1785,Ibs Doujinshi - Ibs And Garrys secret,Shoujo,Na (Pixiv),"Slice of Life, School Life, Shoujo, Comedy, Doujinshi, ","71,451",4,71451,Ib doujinshi 
1786,Gintama Doujinshi - Spectrum,School Life,KLINE - Hitomi,"Shounen, Romance, School Life, Comedy, Doujinshi, Shoujo Ai, ","71,436",4,71436,Chapter 3
1787,Itoshi No Anneli,Comedy,Đang cập nhật,"Romance, Comedy, Yaoi, Shoujo Ai, ","71,428",4,71428,Chapter 5
1788,Đô Thị Chí Tôn Hệ Thống,Manhua,JT,"Manhua, ","71,432",4,71432,Cảm Giác Ad Lúc Này
1789,Shingeki no Kyojin dj :Levi-o-Lantern,Comedy,Đang cập nhật,"Comedy, ","71,426",4,71426,Chapter 1: One shot
1790,Cấp 3,One Shot,Soramanga,"School Life, Comedy, One Shot, Soft Yaoi, ","71,422",4,71422,"""Em muốn ăn gì nào"""
1791,Túy Quyền - Hoàng Ngọc Lang,Manhua,Hoàng Ngọc Lang,"Action, Manhua, Adventure, ","71,438",4,71438,Túy quyền 
1792,Bên anh mới là cả thế giới,Manhua,Đang cập nhật,"Romance, Manhua, ","71,415",4,71415,Chapter 5
1793,Deadheads,One Shot,Nihei Tsutomu,"Seinen, One Shot, Horror, Sci-fi, ","71,412",4,71412,Chapter 1: One shot
1794,To Love-Ru Trouble [Digital Color Edition],Sci-fi,Đang cập nhật,"Harem, Sci-fi, Fantasy, Shounen, Romance, School Life, Comedy, Manga, ","71,411",4,71411,Chapter 11
1795,Như Lai Ma Chưởng,Action,,"Action, Manhua, Adventure, ","71,408",4,71408,Chapter 4: ngã phật bất tái từ bi
1796,Meeting an onee-san after a few years vs. Honest guy,One Shot,ashleydo,"Shoujo, One Shot, ","71,409",4,71409,Oneshot
1797,Amaenaideyo MS,Comedy,Sogabe Toshinori,"Romance, Harem, Comedy, Supernatural, ","71,405",4,71405,Amaenaideyo ms chap 25
1798,Code Geass: Hangyaku no Lelouch,Manga,TANIGUCHI Goro & Okouchi Ichiro,"Action, School Life, Manga, ","71,404",4,71404,Chapter 17
1799,Onee-chan ga Kita,Comedy,Anzai Rikou,"Slice of Life, Seinen, Comedy, ","71,396",4,71396,Chapter 7
1800,Thần Thú Không Được Nói Dối,Manhua,Đang cập nhật,"Fantasy, Manhua, ","71,392",4,71392,Chapter 0
1801,Giấc Mơ Thần Tượng,Shoujo,,"Romance, Shoujo, Comedy, Manhwa, ","71,381",4,71381,Giấc mơ thần tượng chap 11
1802,Maou no migiude ni nattanode gensaku kaiaku shimasu,Fantasy,"Kimura, White","Romance, Fantasy, Xuyên không, Manga, ","26,046",4,26046,Thông báo
1803,Mỹ nhân tâm kế,Manhua,漫客文化,"Cổ Đại, Romance, Manhua, ","71,371",4,71371,Chap 0
1804,GRIMMS MANGA,Romance,Ishiyama Kei,"Romance, Fantasy, Shoujo, Comedy, ","71,371",4,71371,Grimms manga chap 4
1805,diabolo,Supernatural,"Kusunoki Kei,Oohashi Kaoru","Drama, Psychological, Horror, Josei, Supernatural, ","71,363",4,71363,Diabolo chap 1
1806,Nguyệt Lão Không Cho Phép Tôi Yêu Đương,Romance,Đang cập nhật,"Drama, Romance, Shoujo, Manhua, ","71,361",4,71361,Chapter 5
1807,Gekijou Komoriuta,Romance,Nanajima Kana,"Romance, School Life, Shoujo, ","71,344",4,71344,Gekijou komoriuta – chap 5
1808,Mob Psycho 100,School Life,ONE,"Slice of Life, Shounen, Psychological, School Life, Supernatural, Action, Comedy, ","71,341",4,71341,Chapter 91.2
1809,HELLPER - ĐÀO NGỤC ĐỒ,Shoujo,Đang cập nhật,"Seinen, Shoujo, Shounen, ","71,338",4,71338,Chapter 83: 
1810,Câu chuyện trước đêm Giáng Sinh,One Shot,Đang cập nhật,"Comedy, One Shot, ","71,338",4,71338,Chapter 1: One shot
1811,Its Not Meguro-sans First Time,Comedy,họa mi hay hót,"Romance, School Life, Comedy, ","71,333",4,71333,Chapter 1
1812,Chiro chan,Comedy,Đang cập nhật,"School Life, Comedy, ","71,325",4,71325,"Chapter 31: ,32,33,34"
1813,Kettama,Manga,Fudou Ran,"Manga, ","71,323",4,71323,Chapter 8
1814,World Gaze Clips,Slice of Life,,"Slice of Life, School Life, Seinen, ","71,317",4,71317,Chapter 4
1815,Katakoi Triangle,Slice of Life,Amano Shinobu,"Romance, Slice of Life, Shoujo, Comedy, ","71,298",4,71298,Katakoi triangle chap 9
1816,Hiệp Khách Hành,Martial Arts,Lin Ye Qing,"Action, Manhua, Martial Arts, Adventure, Shounen, ","71,312",4,71312,Hiệp khách hành hồi 26 
1817,Npc Nhà Tôi Thật Khó Chọc Ghẹo,Adventure,Đang cập nhật,"Action, Fantasy, Comedy, Manhua, Adventure, ","71,293",4,71293,Chapter 8
1818,trsamurai expressions -cuộc sống của yasuo,Action,comic japan,"Action, Shoujo, ","71,288",4,71288,Trsamurai expressions 
1819,Chousuinou Kei - Makafushigi Jiken File,Adventure,GOMI Kazuo & MIZUNO Mitsuhiro & TANAKA Yoshiki,"Manga, Sci-fi, Adventure, ","71,268",4,71268,Chapter 9
1820,Children’s Time,Shounen,Sugano Akira - Ninomiya Etsumi,"Drama, Slice of Life, Comedy, Shoujo Ai, Shounen, ","71,267",4,71267,Chapter 4
1821,Kaine,One Shot,Kaori Yuki,"One Shot, Manga, ","71,266",4,71266,Chapter 2
1822,Ashita No Nadja,Adventure,,"Drama, Romance, Shoujo, Adventure, Historical, ","71,257",4,71257,Ashita no nadja chap 1
1823,Khách hàng là thượng đế,Shoujo,Đang cập nhật,"Mystery, Sci-fi, Shounen, Shoujo, Comedy, Manga, ","71,253",4,71253,Chapter 2
1824,Rainbow,Tragedy,Kakizaki Masasumi,"Drama, Seinen, Psychological, Historical, Action, Tragedy, ","100,659",4,100659,Chapter 235 (end)
1825,Mạo Bài Đại Anh Hùng,Adventure,,"Fantasy, Martial Arts, Adventure, Manhua, ","71,251",4,71251,Mạo bài đại anh hùng chapter 29
1826,"Dear, my God",Romance,Asada Nemui,"Drama, Psychological, Romance, Soft Yaoi, ","71,250",4,71250,Chapter 2.1
1827,Im The Final Boss,Adventure,Đang cập nhật,"Action, Fantasy, Comedy, Adventure, ","71,246",4,71246,Chapter 9
1828,Acaria,Adventure,,"Fantasy, Comedy, Supernatural, Adventure, Manga, ","71,238",4,71238,Acaria chap 18
1829,Tôn Ngộ Không,Action,Osamu Tezuka,"Shounen, Truyện scan, Supernatural, Adventure, Action, Comedy, ","71,236",4,71236,Chapter 36.1
1830,Ayakashiko,Slice of Life,Hijiki,"Slice of Life, Fantasy, Seinen, Comedy, Supernatural, ","62,608",4,62608,Ayakashiko CHAP 59
1831,Watashi no Kobushi wo Uketomete!,Romance,Đang cập nhật,"Romance, Soft Yuri, Seinen, Comedy, Shoujo-ai, ","71,229",4,71229,Chapter 3.2
